{
  "spend_budget_evaluation_presentment_contract_version": 1,
  "spend_budget_id": "019d7b92-1aa0-7a7f-b61c-962c0f4bfe03",
  "tenant_reference": "urn:cwl:tenant_001",
  "billing_account_id": "019d7001-0000-7000-8000-000000000001",
  "currency_code": "USD",
  "budget_amount": "0.001",
  "rated_amount": "0.003705",
  "remaining_amount": "0",
  "over_amount": "0.002705",
  "utilization_status": "over",
  "window_started_at": "2026-08-16T10:00:00Z",
  "window_ended_at": "2026-08-16T11:00:00Z",
  "spend_budget_status": "published",
  "next_operator_action": "wait"
}
